{
  "$schema": "http://json-schema.org/draft-07/schema#",
  "$id": "property-underwriting.json",
  "title": "PropertyUnderwriting",
  "description": "Underwriter-owned analysis output",
  "type": "object",
  "required": [
    "property_id",
    "annual_gross_rent",
    "annual_operating_expenses",
    "noi",
    "cap_rate",
    "proposed_status",
    "computed_at"
  ],
  "properties": {
    "property_id": { "type": "string" },
    "annual_gross_rent": { "type": "number" },
    "annual_operating_expenses": { "type": "number" },
    "noi": { "type": "number" },
    "cap_rate": { "type": "number", "minimum": 0 },
    "cap_rate_percent": { 
      "type": "string",
      "description": "Human-readable cap rate percentage"
    },
    "proposed_status": {
      "type": "string",
      "enum": ["VIABLE", "WATCHLIST", "REJECTED"]
    },
    "proposed_status_reason": { "type": "string" },
    "input_summary": {
      "type": "object",
      "description": "Summary of input values used in underwriting",
      "additionalProperties": true
    },
    "operating_expense_breakdown": {
      "type": "object",
      "description": "Detailed breakdown of annual operating expenses",
      "additionalProperties": true
    },
    "sensitivity_analysis": {
      "type": "object",
      "description": "Scenario analysis with different assumptions",
      "additionalProperties": true
    },
    "breakeven_analysis": {
      "type": "object",
      "description": "Breakeven analysis for target cap rate",
      "additionalProperties": true
    },
    "risk_factors": {
      "type": "array",
      "description": "List of identified risk factors",
      "items": { "type": "string" }
    },
    "computed_at": { "type": "string", "format": "date-time" }
  },
  "additionalProperties": false
}
