{
  "property_id": "17462-front-beach-rd-unit-31c-panama-city-beach-fl",
  "annual_gross_rent": 38400,
  "annual_operating_expenses": 23404,
  "operating_expense_breakdown": {
    "hoa": 7560,
    "special_assessments": 0,
    "property_taxes": 3064,
    "insurance": 800,
    "management": 7680,
    "utilities": 1800,
    "other": 2500
  },
  "noi": 14996,
  "cap_rate": 0.060,
  "proposed_status": "REJECTED",
  "proposed_status_reason": "Cap rate of 6.0% is significantly below the 10% threshold. Even with optimistic assumptions (high-end rent of $4,000/mo and self-management), cap rate would only reach ~10.5%, which is marginal and requires eliminating professional management entirely. Base case analysis uses conservative rent estimate ($3,200/mo) and standard 20% management fee typical for Panama City Beach STR market. Additionally, special assessments remain UNKNOWN with LOW confidence—the 1983 building has recent major permit activity suggesting potential capital needs, and an estoppel certificate is required to verify assessment status. The high HOA fee ($630/mo) substantially erodes returns.",
  "input_summary": {
    "purchase_price": {
      "value": 249900,
      "status": "VERIFIED",
      "confidence": "HIGH"
    },
    "monthly_rent": {
      "value": 3200,
      "status": "ESTIMATED",
      "confidence": "MEDIUM",
      "range_low": 2800,
      "range_high": 4000
    },
    "hoa_monthly": {
      "value": 630,
      "status": "VERIFIED",
      "confidence": "HIGH"
    },
    "special_assessments": {
      "value": null,
      "status": "UNKNOWN",
      "confidence": "LOW"
    },
    "property_taxes_annual": {
      "value": 3064,
      "status": "VERIFIED",
      "confidence": "HIGH"
    },
    "insurance_annual": {
      "value": 800,
      "status": "ESTIMATED",
      "confidence": "MEDIUM"
    },
    "management_annual": {
      "value": 7680,
      "status": "ESTIMATED",
      "confidence": "MEDIUM"
    },
    "utilities_annual": {
      "value": 1800,
      "status": "ESTIMATED",
      "confidence": "MEDIUM"
    },
    "other_expenses_annual": {
      "value": 2500,
      "status": "ESTIMATED",
      "confidence": "MEDIUM"
    }
  },
  "sensitivity_analysis": {
    "base_case": {
      "rent_monthly": 3200,
      "management_rate": 0.20,
      "cap_rate": 0.060
    },
    "optimistic_case": {
      "rent_monthly": 4000,
      "management_rate": 0.20,
      "cap_rate": 0.083,
      "notes": "High-end rent estimate with professional management"
    },
    "self_managed_optimistic": {
      "rent_monthly": 4000,
      "management_rate": 0,
      "cap_rate": 0.114,
      "notes": "Requires eliminating professional management and achieving high-end rent projections; not representative of hands-off investment"
    }
  },
  "risk_factors": [
    "Special assessments UNKNOWN - building age (1983) and recent permit activity suggest potential capital needs",
    "Highly seasonal rental market with weak winter occupancy (25-35%)",
    "HOA fee ($630/mo) exceeds scrutiny threshold and is above county median",
    "Rent projection relies on STR income which is inherently variable"
  ],
  "computed_at": "2026-08-10T04:55:00Z"
}
